{
  "version": "security-posture/v1",
  "project": {
    "id": "digital-worker-factory",
    "repository": "mikelninh/digital-worker-factory",
    "domain": "cross-domain agent runtime"
  },
  "thesis": "The model can interpret and propose; deterministic identity, scope, authority and effect boundaries decide what can happen.",
  "controls": [
    {
      "id": "authority_outside_model",
      "status": "implemented",
      "evidence": [
        { "type": "code", "path": "core/policy-gate.mjs", "claim": "Capability authority is resolved outside model output." },
        { "type": "code", "path": "core/security-boundary.mjs", "claim": "Instruction provenance cannot grant effect authority." }
      ]
    },
    {
      "id": "least_privilege",
      "status": "implemented",
      "evidence": [
        { "type": "code", "path": "core/capability-registry.mjs", "claim": "Capabilities declare roles, risk and provider." },
        { "type": "test", "path": "core/agent-security-integration.test.mjs", "claim": "Protected scopes and malicious effect requests fail closed." }
      ]
    },
    {
      "id": "tenant_isolation",
      "status": "implemented",
      "evidence": [
        { "type": "code", "path": "core/production-boundary.mjs", "claim": "Production context rejects cross-tenant actors." },
        { "type": "test", "path": "production/platform-v1.test.mjs", "claim": "Persistence and object-store reference boundaries are tenant-scoped." }
      ]
    },
    {
      "id": "human_approval",
      "status": "implemented",
      "evidence": [
        { "type": "code", "path": "core/policy-gate.mjs", "claim": "Write/external capabilities require approval." },
        { "type": "code", "path": "core/trust-chain.mjs", "claim": "Recorded approval identity can be bound to trust evidence." }
      ]
    },
    {
      "id": "provenance",
      "status": "implemented",
      "evidence": [
        { "type": "doc", "path": "architecture/TRUST_STACK_V1.md", "claim": "Source, integrity, authority, exact evidence, derivation and decision form the common trust chain." },
        { "type": "test", "path": "core/trust-chain.test.mjs", "claim": "Trust-chain invariants are regression tested." }
      ]
    },
    {
      "id": "protected_data",
      "status": "implemented",
      "evidence": [
        { "type": "code", "path": "core/security-boundary.mjs", "claim": "Secrets, credentials, system prompt, policy/audit mutation and cross-tenant scopes are protected." },
        { "type": "code", "path": "core/production-boundary.mjs", "claim": "Sensitive audit values are redacted." }
      ]
    },
    {
      "id": "bounded_execution",
      "status": "implemented",
      "evidence": [
        { "type": "code", "path": "core/security-boundary.mjs", "claim": "Tool-call and subagent-depth ceilings fail closed." },
        { "type": "test", "path": "security/security-gauntlet.test.mjs", "claim": "Budget exhaustion and recursive-depth attacks are regression cases." }
      ]
    },
    {
      "id": "auditability",
      "status": "implemented",
      "evidence": [
        { "type": "code", "path": "core/production-boundary.mjs", "claim": "Runtime security denials and trust decisions are attached to production audit events." },
        { "type": "code", "path": "production/platform-v1.mjs", "claim": "Effect queue records security/trust decision evidence." }
      ]
    },
    {
      "id": "supply_chain",
      "status": "partial",
      "evidence": [
        { "type": "code", "path": "core/security-boundary.mjs", "claim": "Known-bad components are blocked and unverified components are surfaced for review." },
        { "type": "test", "path": "security/security-gauntlet.test.mjs", "claim": "Supply-chain attack states are covered in the shared gauntlet." }
      ]
    },
    {
      "id": "adversarial_evals",
      "status": "implemented",
      "evidence": [
        { "type": "test", "path": "security/security-gauntlet.test.mjs", "claim": "40 cross-domain adversarial cases cover OWASP Agentic Top 10 categories." },
        { "type": "report", "path": "security/live-replay-report.json", "claim": "Captured live-model unsafe proposals are replayed through the real AgentGateway with executor-level zero-impact evidence." },
        { "type": "ci", "path": ".github/workflows/security-stack.yml", "claim": "Deterministic gauntlet and captured live-model replay are CI release gates." }
      ]
    },
    {
      "id": "production_monitoring",
      "status": "partial",
      "evidence": [
        { "type": "code", "path": "core/production-boundary.mjs", "claim": "Runtime security denials and trust decisions are auditable." },
        { "type": "doc", "path": "architecture/SECURITY_STACK_V1.md", "claim": "Real incident response and production anomaly evidence remain explicit residual work." }
      ]
    }
  ],
  "adversarial": {
    "taxonomy": "OWASP Top 10 for Agentic Applications 2026 + captured live-model compromised-output replays",
    "cases": 43,
    "passed": 43,
    "criticalEscapes": 0,
    "liveModel": true
  },
  "claims": {
    "productionSecure": false,
    "promptInjectionSolved": false,
    "certified": false
  },
  "residualRisks": [
    "Live-model evidence is an interactive captured red-team session replayed deterministically in CI; it has no provider-signed request receipt and is not a continuous online-model release gate.",
    "The replay proves containment after unsafe model output, not prompt-injection detection or immunity.",
    "SBOM, signatures and complete dependency provenance are not yet part of this shared contract.",
    "Production incident/anomaly monitoring needs real deployment evidence.",
    "Domain adapters must add stricter legal, clinical, administrative or customer-specific release gates.",
    "External security review is required before production-security claims."
  ]
}
